,Region,County,Area,Beach Name,Beach URL,Address1,Address2,Park Name,Owner URL,Activities,Amenities,Pet Policy,Fees,Phone,Other Names
690,Northern,San Mateo County,Pescadero,Gazos Creek Beach,https://www.californiabeaches.com/beach/gazos-creek-beach/,Gazos Creek Rd and Cabrillo Hwy,"Pescadero, CA 94060","Ano Nuevo State Reserve, Gazos Creek Day Use Area",http://www.parks.ca.gov/?page_id=523,"Kiteboarding, Windsurfing, Fishing, Beachcombing, Birdwatching","Toilets, Driftwood, Restaurant",No dogs allowed in the park,Free parking,,
691,Northern,San Mateo County,Pescadero,Pebble Beach At Bean Hollow State Beach,https://www.californiabeaches.com/beach/pebble-beach-at-bean-hollow-state-beach/,Cabrillo Hwy,"Pescadero, CA 94060",Bean Hollow State Beach,http://www.parks.ca.gov/?page_id=527,"Hiking, Tidepooling, Fishing, Birdwatching","Restrooms, Nature Trail, Picnic Tables, BBQs, Tide Pools, Tafoni Rocks",Dogs allowed on leash,No fee for parking,,
692,Northern,San Mateo County,Pescadero,Pescadero Point Beach,https://www.californiabeaches.com/beach/pescadero-point-beach/,12371 Cabrillo Hwy,"Pescadero, CA 94060",,,"Beach Exploration, Beach Walking, Tidepooling","Tide Pools, No Facilities",Dogs allowed on leash,Free parking,,
693,Northern,San Mateo County,Pescadero,Pescadero State Beach North Beach,https://www.californiabeaches.com/beach/pescadero-state-beach-north-beach/,Cabrillo Hwy,"San Gregorio, CA 94074","Pescadero State Beach, Pescadero Marsh Natural Preserve",http://www.parks.ca.gov/?page_id=522,"Beachcombing, Beach Walking, Birdwatching, Fishing, Hiking, Surfing","Restrooms, Trails, Nature Preserve, Dunes, Driftwood, Wetlands, Rock Arch",No dogs allowed on beach or in natural areas,Fee for parking,,Sand Beach (USGS)
694,Northern,San Mateo County,Pescadero,Pescadero State Beach South Beach,https://www.californiabeaches.com/beach/pescadero-state-beach-south-beach/,Pescadero Creek Rd and Cabrillo Hwy,"Pescadero, CA 94060","Pescadero State Beach, Pescadero Marsh Natural Preserve",http://www.parks.ca.gov/?page_id=522,"Beach Exploration, Birdwatching, Fishing, Hiking, Swimming, Kayaking, Stand-Up Paddleboarding","Restrooms, Trails, Nature Preserve, Tide Pools, Picnic Tables, Creek, Lagoon, Rock Arch",No dogs allowed on beach or in natural areas,Fee for parking,,
695,Northern,San Mateo County,Pescadero,Pigeon Point Light Station State Historic Park,https://www.californiabeaches.com/beach/pigeon-point-light-station-state-historic-park/,210 Pigeon Point Rd,"Pescadero, CA 94060",Pigeon Point Light Station State Historic Park,http://www.parks.ca.gov/?page_id=533,"Walking, Birdwatching, Whale Watching, Tidepooling","Lighthouse, Hostel, Ocean Overlook, Tide Pools, Restrooms, Trails, Guided Tours, Bookstore","Dogs allowed on leash, but not at the lighthouse grounds",No fee for parking,,
696,Northern,San Mateo County,Pescadero,Pistachio Beach,https://www.californiabeaches.com/beach/pistachio-beach/,Pigeon Point Rd and Cabrillo Hwy,"Pescadero, CA 94060",Pigeon Point Light Station State Historic Park,http://www.parks.ca.gov/?page_id=533,"Birdwatching, Whale Watching, Beach Walking","Tide Pools, No Facilities",Dogs allowed on leash,Free parking,,
697,Northern,San Mateo County,Pescadero,Point Ano Nuevo Beach,https://www.californiabeaches.com/beach/point-ano-nuevo-beach/,1 New Years Creek Rd,"Pescadero, CA 94060","Ano Nuevo State Reserve, Ano Nuevo Coast Natural Preserve",http://www.parks.ca.gov/?page_id=523,"Wildlife Watching, Hiking","Guided Tours, Trails, Dunes, Restrooms, Lighthouse, Farm, Accessible Features",No dogs allowed in the park,"Fee for parking, guided tours",,Bight Beach
698,Northern,San Mateo County,Pescadero,Whalers Cove,https://www.californiabeaches.com/beach/whalers-cove/,210 Pigeon Point Rd,"Pescadero, CA 94060",Pigeon Point Light Station State Historic Park,http://www.parks.ca.gov/?page_id=533,"Tidepooling, Walking","Lighthouse, Restrooms, Tide Pools, Trails, Hostel","Dogs allowed on leash at cove, but not at the lighthouse grounds",Free parking,,
699,Northern,San Mateo County,Pescadero,Whitehouse Creek Beach Access,https://www.californiabeaches.com/beach/whitehouse-creek-beach-access/,Whitehouse Canyon Rd and Cabrillo Hwy,"Pescadero, CA 94060",Ano Nuevo State Reserve,http://www.parks.ca.gov/?page_id=523,"Hiking, Beach Exploration, Camping","Trails, Campground, Restaurant, No Facilities",No dogs allowed in the park,Free parking,,
700,Northern,San Mateo County,San Gregorio,Pescadero State Beach North Beach,https://www.californiabeaches.com/beach/pescadero-state-beach-north-beach/,Cabrillo Hwy,"San Gregorio, CA 94074","Pescadero State Beach, Pescadero Marsh Natural Preserve",http://www.parks.ca.gov/?page_id=522,"Beachcombing, Beach Walking, Birdwatching, Fishing, Hiking, Surfing","Restrooms, Trails, Nature Preserve, Dunes, Driftwood, Wetlands, Rock Arch",No dogs allowed on beach or in natural areas,Fee for parking,,Sand Beach (USGS)
701,Northern,San Mateo County,San Gregorio,Pomponio State Beach,https://www.californiabeaches.com/beach/pomponio-state-beach/,Cabrillo Hwy,"San Gregorio, CA 94074",Pomponio State Beach,http://www.parks.ca.gov/?page_id=521,"Beachcombing, Beach Walking","Restrooms, Picnic Tables, BBQs, Driftwood",No dogs allowed on the beach,Fee for parking,,
702,Northern,San Mateo County,San Gregorio,San Gregorio Private Beach,https://www.californiabeaches.com/beach/san-gregorio-private-beach/,19429 Cabrillo Hwy,"San Gregorio, CA 94074",,,"Sunbathing, Beach Walking, Fishing","Driftwood, Caves, Toilets, Tide Pools",Dogs allowed except on weekends and holidays,Fee charged for parking,,
703,Northern,San Mateo County,San Gregorio,San Gregorio State Beach,https://www.californiabeaches.com/beach/san-gregorio-state-beach/,La Honda Rd and Cabrillo Hwy,"San Gregorio, CA 94074",San Gregorio State Beach,http://www.parks.ca.gov/?page_id=529,"Hiking, Beachcombing, Birdwatching, Beach Walking","Restrooms, Picnic Tables, BBQs, Driftwood, Caves, Trails, Fossils",No dogs allowed on the beach,Fee for parking,,
704,Northern,San Mateo County,San Gregorio,Tunitas Creek Beach,https://www.californiabeaches.com/beach/tunitas-creek-beach/,Tunitas Creek Rd and Cabrillo Hwy S,"Half Moon Bay, CA 94019",,https://openspacetrust.org/blog/tunitas-creek-beach/,"Surfing, Beach Exploration, Birdwatching","Creek, No Facilities",Dogs are not allowed on the beach,No fee for parking,,
705,Northern,San Mateo County,San Mateo,Coyote Point Beach,https://www.californiabeaches.com/beach/coyote-point-beach/,1701 Coyote Point Dr,"San Mateo, CA 94401","Coyote Point Park, Coyote Point Recreation Area",http://parks.smcgov.org/coyote-point-recreation-area,"Windsurfing, Kiteboarding, Boating, Birdwatching, Golfing, Walking, Fishing, Biking","Grass Park, Kids Play Area, Restrooms, Picnic Tables, Golf Course, Promenade, Trails, Paved Bike Path",Dogs are not allowed in the park,,,
706,Northern,San Mateo County,South San Francisco,Oyster Cove Beach,https://www.californiabeaches.com/beach/oyster-cove-beach/,Oyster Point Blvd,"South San Francisco, CA 94080",Oyster Point Park and Marina,http://www.smharbor.com/oysterpoint/,"Swimming, Fishing, Boating","Fishing Pier, Boat Launch, Grass Park, Trails, Picnic Tables",,,,Oyster Point Beach
707,Northern,San Francisco County,San Francisco,Alcatraz Island,https://www.californiabeaches.com/beach/alcatraz-island/,1398 The Embarcadero,"San Francisco, CA 94133",Golden Gate National Recreation Area,http://www.nps.gov/alca/,"Guided Tours, Walking, Birdwatching, Photography","Prison Tour, Bay Cruise, Museum, Bookstore, Restrooms",No dogs allowed on the island,"Fee includes boat tour, island entrance, and prison audio tour",,
708,Northern,San Francisco County,San Francisco,Aquatic Park Cove,https://www.californiabeaches.com/beach/aquatic-park-cove/,Beach St and Hyde St,"San Francisco, CA 94109","Aquatic Park Historic District, Fort Mason, San Francisco Maritime National Historical Park, Golden Gate National Recreation Area",http://www.nps.gov/safr/planyourvisit/aquaticparkcove.htm,"Walking, Swimming, Boating","Pier, Museum, Grass Park, Walking Path, Benches, Cable Car Stop, Historic Ships",,Metered parking near beach,,Aquatic Park Lagoon
709,Northern,San Francisco County,San Francisco,Baker Beach San Francisco,https://www.californiabeaches.com/beach/baker-beach-san-francisco/,Bowley St and Gibson Rd,"San Francisco, CA 94129",Golden Gate National Recreation Area,http://www.nps.gov/prsf/planyourvisit/baker-beach.htm,"Fishing, Sunbathing, Walking, Hiking","Restrooms, Picnic Tables, Military Gun Structures",No dogs allowed on the beach,Free parking,,
710,Northern,San Francisco County,San Francisco,Candlestick Point State Recreation Area,https://www.californiabeaches.com/beach/candlestick-point-state-recreation-area/,Hunters Point Expy,"San Francisco, CA 94124",Candlestick Point State Recreation Area,http://www.parks.ca.gov/?page_id=519,"Windsurfing, Kiteboarding, Walking, Fishing, Birdwatching, Picnicking, Biking, Kayaking","Grass Park, Trails, Paved Bike Path, Fishing Pier, Picnic Tables, BBQs, Accessible Features, Fishing Pier",Dogs allowed on leash in park and on beaches,,,"Windsurfer Circle, Jack Rabbit Beach"
711,Northern,San Francisco County,San Francisco,China Beach,https://www.californiabeaches.com/beach/china-beach/,340 Sea Cliff Ave,"San Francisco, CA 94121","Golden Gate National Recreation Area, China Beach Park",http://www.nps.gov/goga/planyourvisit/chinabeach.htm,"Sunbathing, Picnicking, Tidepooling","Restrooms, Showers, Picnic Tables, Tide Pools, Cave",No dogs allowed on the beach,Free parking,,
712,Northern,San Francisco County,San Francisco,Clipper Cove Beach On Yerba Buena Island,https://www.californiabeaches.com/beach/clipper-cove-beach-on-yerba-buena-island/,Treasure Island Rd,"San Francisco, CA 94130",Clipper Cove Picnic Area Park,,Picnicking,Grass Park,,,,
713,Northern,San Francisco County,San Francisco,East Beach At Crissy Field,https://www.californiabeaches.com/beach/east-beach-at-crissy-field/,1199 E Beach,"San Francisco, CA 94129","Crissy Field Park, Presidio, Golden Gate National Recreation Area",https://www.presidio.gov/places/east-beach,"Windsurfing, Kiteboarding, Birdwatching, Walking, Running, Biking, Sunbathing","Picnic Tables, Restrooms, Cafe, Grass Park, Bike Path, Trails, Historic Buildings, Fishing Pier",Dogs allowed off leash if under voice control,Free parking,,
714,Northern,San Francisco County,San Francisco,West Bluffs Beach At Crissy Field,https://www.californiabeaches.com/beach/west-bluffs-beach-at-crissy-field/,Marine Drive,"San Francisco, CA 94129","Crissy Field Park, Fort Point National Historic Site, Presidio, Golden Gate National Recreation Area",http://www.presidio.gov/explore/Pages/crissy-field-picnic-east-beach-west-bluffs.aspx,"Windsurfing, Kiteboarding, Birdwatching, Walking, Running, Biking","Picnic Tables, Restrooms, Cafe, Historical Sites, Grass Fields, Pier, Lighthouse, Trails",Dogs allowed off leash if under voice control,Free parking,,West Bluffs
715,Northern,San Francisco County,San Francisco,Fort Funston Beach,https://www.californiabeaches.com/beach/fort-funston-beach/,Skyline Blvd and John Muir Dr,"San Francisco, CA 94132",Golden Gate National Recreation Area,http://www.nps.gov/goga/planyourvisit/fortfunston.htm,"Hang Gliding, Hiking, Beachcombing, Equestrian Use, Beach Walking, Fishing, Biking","Trails, Viewing Platform, Toilets, Fossils, Military Ruins",Dogs allowed off leash if under voice control,Free parking,,
716,Northern,San Francisco County,San Francisco,Golden Gate Park Beach,https://www.californiabeaches.com/beach/golden-gate-park-beach/,1000 Great Highway,"San Francisco, CA 94121","Golden Gate Park, Golden Gate National Recreation Area",http://sfrecpark.org/destination/golden-gate-park/,"Walking, Biking, Running, Golf, Disc Golf, Tennis, Horseshoes, Beach Walking, Birdwatching","Grass Park, Walking Paths, Golf Course, Sports Fields, Sport Courts, Botanical Garden, Japanese Garden, Museums, Fly Casting Ponds, Carousel, Kids Play Area",Dogs allowed off leash on beach if under voice control,Free parking at the beach,,
717,Northern,San Francisco County,San Francisco,Herons Head Park,https://www.californiabeaches.com/beach/herons-head-park/,Cargo Way and Jennings St.,"San Francisco, CA 94124","Heron's Head Park, Port of San Francisco",http://www.sfport.com/index.aspx?page=210,"Birdwatching, Walking","Picnic Tables, Bird-viewing Areas, Paved Path, Education Center",Dogs allowed on leash on trails. There is an off-leash dog area in the park.,,,
718,Northern,San Francisco County,San Francisco,Marshall Beach,https://www.californiabeaches.com/beach/marshall-beach/,Lincoln Blvd and Langdon Ct,"San Francisco, CA 94129",Golden Gate National Recreation Area,http://www.nps.gov/goga/,"Hiking, Sunbathing","Military Structures, Viewpoint, Trails, No Facilities",No dogs allowed on beach,Free parking at the Golden Gate Overlook,,"Golden Gate Beach, Marshall's"
719,Northern,San Francisco County,San Francisco,Lands End Beach,https://www.californiabeaches.com/beach/lands-end-beach/,El Camino Del Mar,"San Francisco, CA 94121","Golden Gate National Recreation Area, Fort Miley, Lincoln Park",http://www.nps.gov/goga/planyourvisit/landsend.htm,"Hiking, Beach Exploration, Photography","Trails, Picnic Tables, Viewpoint, Military Gun Structures, Lighthouse, Shipwrecks, Labyrinth",Dogs allowed off leash if under voice control,Free parking,,Mile Rock Beach
720,Northern,San Francisco County,San Francisco,North Baker Beach,https://www.californiabeaches.com/beach/north-baker-beach/,Bowley St and Gibson Rd,"San Francisco, CA 94129",Golden Gate National Recreation Area,http://www.nps.gov/prsf/planyourvisit/baker-beach.htm,"Sunbathing, Hiking","Trails, Volleyball Court, No Facilities",Dogs allowed off leash if under voice control,Free parking,,
721,Northern,San Francisco County,San Francisco,Ocean Beach San Francisco,https://www.californiabeaches.com/beach/ocean-beach-san-francisco/,Sloat Blvd and Great Hwy,"San Francisco, CA 94132",Golden Gate National Recreation Area,http://www.nps.gov/goga/planyourvisit/oceanbeach.htm,"Beach Walking, Walking, Running, Biking, Sunbathing, Windsurfing, Kiteboarding","Restrooms, Promenade, Paved Bike Lane, Dunes, Zoo, Fire Pits",Dogs allowed off leash if under voice control except from Sloat Blvd to Stairwell 21 where leashes are required,Free parking,,
722,Northern,San Francisco County,San Francisco,Phillip Burton Memorial Beach,https://www.californiabeaches.com/beach/phillip-burton-memorial-beach/,John Daly Blvd and California 35,"Daly City, CA 94015",,,"Fishing, Hiking, Beachcombing, Photography","Cave, Trails, No Facilities",Dogs allowed on leash,Free parking at Fort Funston or Thornton State Beach,,
723,Northern,San Francisco County,San Francisco,Sutro Baths,https://www.californiabeaches.com/beach/sutro-baths/,680 Point Lobos Ave,"San Francisco, CA 94121",Golden Gate National Recreation Area,http://www.nps.gov/goga/planyourvisit/sutro.htm,"Hiking, Photography","Historic Bath Ruins, Visitor Center, Trails, Tunnel, Rock Arch",Dogs allowed on leash,Free parking,,
724,Northern,San Francisco County,San Francisco,Treasure Island San Francisco,https://www.californiabeaches.com/beach/treasure-island-san-francisco/,Avenue of the Palms and California Ave,"San Francisco, CA 94130",,,,,,Currently there are no fees for entering or parking on the island,,Treasure Isle
725,Northern,Marin County,Bolinas,Alamere Creek Beach,https://www.californiabeaches.com/beach/alamere-creek-beach/,End of Mesa Road,"Bolinas, CA 94924",Point Reyes National Seashore,http://www.nps.gov/pore/,"Beach Exploration, Hiking, Beachcombing, Photography","Waterfall, Trails, No Facilities",No dogs allowed on beach,Free parking at trailhead,,
726,Northern,Marin County,Bolinas,Bolinas Beach,https://www.californiabeaches.com/beach/bolinas-beach/,Brighton Ave and Cliff Rd,"Bolinas, CA 94924",,,"Surfing, Bodyboarding, Birdwatching, Kayaking, Stand-Up Paddleboarding, Sunbathing","Restrooms, Tennis Court",Dogs allowed off leash,Free street parking,,Brighton Beach
727,Northern,Marin County,Bolinas,Agate Beach County Park Bolinas,https://www.californiabeaches.com/beach/agate-beach-county-park-bolinas/,Ocean Pkwy and Elm Rd,"Bolinas, CA 94924","Agate Beach County Park, Duxbury Reef State Marine Reserve",http://www.marincounty.org/depts/pk/divisions/parks/agate-beach,"Tidepooling, Wildlife Watching, Fishing","Tide Pools, Toilets, Benches, Viewpoint",Dogs allowed on leash,Free parking,,
728,Northern,Marin County,Bolinas,Palomarin Beach,https://www.californiabeaches.com/beach/palomarin-beach/,End of Mesa Road,"Bolinas, CA 94924",Point Reyes National Seashore,http://www.nps.gov/pore/,"Hiking, Beachcombing, Tidepooling","Restrooms, Trails, Tide Pools",No dogs allowed on beach,Free parking,,
729,Northern,Marin County,Bolinas,Rca Beach,https://www.californiabeaches.com/beach/rca-beach/,499 Mesa Road,"Bolinas, CA 94924",,,"Sunbathing, Beachcombing","No Facilities, Waterfall, Tide Pools",No dogs allowed on the beach,Free parking,,
730,Northern,Marin County,Dillon Beach,Dillon Beach,https://www.californiabeaches.com/beach/dillon-beach/,1 Beach Avenue,"Dillon Beach, CA 94929",,http://www.dillonbeachresort.com/,"Surfing, Bodyboarding, Tidepooling, Bonfires","Restrooms, Picnic Tables, Fire Pits, Cabins / Cottages, Cafe, Store, Tide Pools",Dogs allowed on leash,Fee for parking at the beach,,
731,Northern,Marin County,Dillon Beach,Estero De San Antonio Beach,https://www.californiabeaches.com/beach/estero-de-san-antonio-beach/,Oceana Drive and Lelani Lane,"Dillon Beach, CA 94929",Estero de San Antonio State Marine Recreational Management Area (SMRMA),http://www.californiampas.org/mpa-regions/north-central-coast-region,"Kayaking, Birdwatching, Waterfowl Hunting",No Facilities,No dogs allowed on the private easement trail,,,
732,Northern,Marin County,Dillon Beach,Lawsons Landing Beach,https://www.californiabeaches.com/beach/lawsons-landing-beach/,137 Marine View Drive,"Dillon Beach, CA 94929",,http://www.lawsonslanding.com/,"Fishing, Boating, Camping, Kayaking, Clam Digging, Crabbing, Beach Walking","Campground, Boat Rentals, Boat Launch, Dunes, Store",Dogs allowed off-leash on beach and on-leash in campground,Fees for day-use and camping,,"Sand Point Beach, Brazil Beach"
733,Northern,Marin County,Inverness,Abbotts Lagoon Beach,https://www.californiabeaches.com/beach/abbotts-lagoon-beach/,Pierce Point Rd,"Inverness, CA 94937",Point Reyes National Seashore,http://www.nps.gov/pore/,"Hiking, Birdwatching, Beachcombing, Whale Watching","Restrooms, Lagoon, Trails, Dunes",No dogs allowed on trail or beach,Free parking at trailhead,,
734,Northern,Marin County,Inverness,Avalis Beach,https://www.californiabeaches.com/beach/avalis-beach/,,"Inverness, CA 94937",Point Reyes National Seashore,http://www.nps.gov/pore/planyourvisit/campgrounds.htm,"Boating, Kayaking",Boat-in Campground,No dogs allowed on beach,,,
735,Northern,Marin County,Inverness,Chicken Ranch Beach,https://www.californiabeaches.com/beach/chicken-ranch-beach/,Sir Francis Drake Blvd and Pine Hill Drive,"Inverness, CA 94937",Chicken Ranch Beach Park,http://www.marincounty.org/depts/pk/divisions/parks/chicken-ranch-beach,"Kayaking, Canoeing, Stand-Up Paddleboarding, Swimming, Picnicking","Toilets, Benches",Dogs allowed on leash,Free parking,,
736,Northern,Marin County,Inverness,Chimney Rock,https://www.californiabeaches.com/beach/chimney-rock/,Sir Francis Drake Blvd and Chimney Rock Rd,"Inverness, CA 94937","Point Reyes National Seashore, Point Reyes State Marine Reserve",https://www.nps.gov/pore/planyourvisit/chimney_rock.htm,"Walking, Hiking, Wildlife Watching, Whale Watching","Lighthouse, Visitor Center, Restrooms, Trails, Overlook, Wildflowers, Elephant Seal Rookery",No dogs allowed on trail or beach,"Free parking, fee for shuttle in winter months",,
737,Northern,Marin County,Inverness,Drakes Beach,https://www.californiabeaches.com/beach/drakes-beach/,Drakes Beach Rd,"Inverness, CA 94937","Point Reyes National Seashore, Point Reyes State Marine Reserve",http://www.nps.gov/pore/,"Beachcombing, Beach Walking, Birdwatching","Restrooms, Picnic Tables, Bookstore, Visitor Center, Bay Overlook, Lagoon",No dogs allowed on beach,Free parking,,
738,Northern,Marin County,Inverness,Drakes Estero Beach,https://www.californiabeaches.com/beach/drakes-estero-beach/,17171 Sir Francis Drake Blvd,"Inverness, CA 94937","Point Reyes National Seashore, Phillip Burton Wilderness Area, Drakes Estero State Marine Conservation Area",https://www.nps.gov/pore/,"Birdwatching, Wildlife Watching, Kayaking, Hiking",Restrooms,No dogs allowed,Free parking,,Drakes Bay
739,Northern,Marin County,Inverness,Driftwood Beach,https://www.californiabeaches.com/beach/driftwood-beach/,Pierce Point Rd,"Inverness, CA 94937","Point Reyes National Seashore, Tule Elk Reserve",http://www.nps.gov/pore/,"Beach Exploration, Hiking, Wildlife Watching","Trails, Elk Herds, No Facilities",No dogs allowed on trail,Free parking at trailhead,,
740,Northern,Marin County,Inverness,Duck Beach,https://www.californiabeaches.com/beach/duck-beach/,,"Inverness, CA 94937",Point Reyes National Seashore,http://www.nps.gov/pore/planyourvisit/campgrounds.htm,"Boating, Kayaking",Boat-in Campground,No dogs allowed on beach,,,
741,Northern,Marin County,Inverness,Duck Cove Beach,https://www.californiabeaches.com/beach/duck-cove-beach/,Marshall Beach Rd and Duck Cove Rd,"Inverness, CA 94937",,,,No Public Facilities,,,,
742,Northern,Marin County,Inverness,Elk Fence North Beach,https://www.californiabeaches.com/beach/elk-fence-north-beach/,,"Inverness, CA 94937",Point Reyes National Seashore,http://www.nps.gov/pore/planyourvisit/campgrounds.htm,"Boating, Kayaking",Boat-in Campground,Dogs allowed on beach if brought in by boat,,,
743,Northern,Marin County,Inverness,Elk Fence South Beach,https://www.californiabeaches.com/beach/elk-fence-south-beach/,,"Inverness, CA 94937",Point Reyes National Seashore,http://www.nps.gov/pore/planyourvisit/campgrounds.htm,"Boating, Kayaking",Boat-in Campground,Dogs allowed on beach if brought in by boat,,,
744,Northern,Marin County,Inverness,Fruit Tree Beach,https://www.californiabeaches.com/beach/fruit-tree-beach/,,"Inverness, CA 94937",Point Reyes National Seashore,http://www.nps.gov/pore/planyourvisit/campgrounds.htm,"Boating, Kayaking",Boat-in Campground,Dogs allowed on beach if brought in by boat,,,
745,Northern,Marin County,Inverness,Hearts Desire Beach Tomales Bay State Park,https://www.californiabeaches.com/beach/hearts-desire-beach-tomales-bay-state-park/,1208 Pierce Point Road,"Inverness, CA 94937",Tomales Bay State Park,http://www.parks.ca.gov/?page_id=470,"Swimming, Boating, Kayaking, Hiking, Picnicking, Clam Digging, Birdwatching","Restrooms, Picnic Tables, BBQs, Hand-carry Boat Launch, Swimming Area, Trails, Accessible Features",No dogs allowed on the beach or the trails,Fee for parking,,
746,Northern,Marin County,Inverness,Indian Beach Tomales Bay State Park,https://www.californiabeaches.com/beach/indian-beach-tomales-bay-state-park/,1208 Pierce Point Road,"Inverness, CA 94937",Tomales Bay State Park,http://www.parks.ca.gov/?page_id=470,"Hiking, Birdwatching","Toilet, Interpretive Trail, Wetlands",No dogs allowed on the beach or the trails,Fee for parking,,
747,Northern,Marin County,Inverness,Jacks Beach,https://www.californiabeaches.com/beach/jacks-beach/,,"Inverness, CA 94937",Point Reyes National Seashore,http://www.nps.gov/pore/planyourvisit/campgrounds.htm,"Boating, Kayaking",Boat-in Campground,No dogs allowed on beach,,,
748,Northern,Marin County,Inverness,Kehoe Beach,https://www.californiabeaches.com/beach/kehoe-beach/,Pierce Point Rd,"Inverness, CA 94937",Point Reyes National Seashore,http://www.nps.gov/pore/,"Hiking, Beachcombing, Beach Walking","Restrooms, Dunes, Trails",Dogs allowed on leash,Free parking,,
749,Northern,Marin County,Inverness,Kilkenny Beach,https://www.californiabeaches.com/beach/kilkenny-beach/,,"Inverness, CA 94937",Point Reyes National Seashore,http://www.nps.gov/pore/planyourvisit/campgrounds.htm,"Boating, Kayaking",Boat-in Campground,Dogs allowed on beach if brought in by boat,,,
750,Northern,Marin County,Inverness,Long Cove Beach,https://www.californiabeaches.com/beach/long-cove-beach/,,"Inverness, CA 94937",Point Reyes National Seashore,http://www.nps.gov/pore/planyourvisit/campgrounds.htm,"Boating, Kayaking",Boat-in Campground,Dogs allowed on beach if brought in by boat,,,
751,Northern,Marin County,Inverness,Marshall Beach Tomales Bay,https://www.californiabeaches.com/beach/marshall-beach-tomales-bay/,Marshall Beach Rd,"Inverness, CA 94937",Point Reyes National Seashore,http://www.nps.gov/pore/,"Hiking, Boating, Kayaking, Mountain Biking","Toilets, Boat-in Campground",Dogs allowed on beach if brought in by boat,,,
752,Northern,Marin County,Inverness,Mcclures Beach,https://www.californiabeaches.com/beach/mcclures-beach/,Pierce Point Rd,"Inverness, CA 94937",Point Reyes National Seashore,http://www.nps.gov/pore/,"Hiking, Beachcombing","Restrooms, Tide Pools, Elk, Trail",No dogs allowed on trail or beach,Free parking,,Pierce Point Beach
753,Northern,Marin County,Inverness,No Name Beach,https://www.californiabeaches.com/beach/no-name-beach/,,"Inverness, CA 94937",Point Reyes National Seashore,http://www.nps.gov/pore/planyourvisit/campgrounds.htm,"Boating, Kayaking",Boat-in Campground,Dogs allowed on beach if brought in by boat,,,
754,Northern,Marin County,Inverness,North Blue Gum Beach,https://www.californiabeaches.com/beach/north-blue-gum-beach/,,"Inverness, CA 94937",Point Reyes National Seashore,http://www.nps.gov/pore/planyourvisit/campgrounds.htm,"Boating, Kayaking",Boat-in Campground,No dogs allowed on beach,,,
